Text,BAL,BNP,NCP,BangladeshJamaat_e_Islami,AB_Party,UPB,JaPa,GOP
আগামীর বাংলাদেশ ইসলামের বাংলাদেশ,2,2,2,1,2,2,2,2
"জাসদী সফিক কয়দিন আগে বল্লো গীতার ভিত্তিতে ন্যায় বিচার প্রতিষ্ঠার কথা এখন বলছে কোরআন সুন্নার কথা, এটা কিরে ভাই !!? একোন মোনাফেকি",2,2,2,3,2,2,2,2
বাংলাদেশ একমাত্র জমায়াতে ইসলামীর হাতেই নিরাপদ।,2,2,2,1,2,2,2,2
আল্লাহর কাছে দোয়া করি খুব শীঘ্রই যেনো জামায়াত ক্ষমতায় আসে,2,2,2,1,2,2,2,2
দেশের বর্তমান রাজনৈতিক দলের চরিত্র থেকে আপনাদের নেতাকর্মীদের চরিএ অনেকটাই ভালো,2,2,2,1,2,2,2,2
"এই দেশকে বদলাবে বক্তৃতা নয়, আদর্শের আগুন! যে আদর্শের নাম জামায়াতে ইসলামী — ন্যায়ের পতাকা, বিশ্বাসের শক্তি, পরিবর্তনের প্রতীক!",2,2,2,1,2,2,2,2
যে কেউ ক্ষমতায় আসুক সমস্যা নেই কিন্তু পাকিস্তানি এজেন্ট জামায়াত ইসলাম যেনো না আসে।,2,2,2,3,2,2,2,2
ইসলামি লেবাসের বিদায় জানাইছে জামাতিরা ক্ষমতার মোহে,2,2,2,3,2,2,2,2
বিএনপি-সহ একটি বিশাল চক্র জামায়াতে ইসলামীকে কোনঠাসা করতে মাঠে নেমেছে!,2,3,2,1,2,2,2,2
কিসের মুজিব কিসের জিয়া দেশ চলবে কুরআন দিয়া..!,3,3,2,1,2,2,2,2
দেখো ভাইয়া দেখো…মোনাফিকের হাট বাজার দেখো,2,2,2,3,2,2,2,2
জনগন চাচ্ছে আপনাদের মাধ্যমে পরিপূর্ণ শরিয়াহ দ্বারা খিলাফাহ রাষ্ট্র প্রতিষ্ঠা হোক ।,2,2,2,1,2,2,2,2
জামাত ইসলামের চেতনা আল্লাহর বিধান ক্ষমতায় আনা।,2,2,2,1,2,2,2,2
আল্লাহ বাংলাদেশ জামায়াতে ইসলামীর সকল সদস্য ও কর্মীদের দ্বীন কায়েমের সৈনিক হিসেবে কবুল করুন আমিন,2,2,2,1,2,2,2,2
"গাজীপুরের ধর্ষণের ঘটনায় প্রতিবাদ না করাই, সকল মুনাফিকদের বয়কট।",2,2,2,3,2,2,2,2
জামাতচুদি,2,2,2,4,2,2,2,2
"ইনশাআল্লাহ, পরিবারের সবাই জামাতকে ভোট দিবো।",2,2,2,1,2,2,2,2
ইসলাম ছাড়া এই দেশে শান্তি আসবেনা এটা লিখে রাখেন।,2,2,2,1,2,2,2,2
জামায়াত সবসময় মানুষ গড়ার কারিগর,2,2,2,1,2,2,2,2
জামাতে ইসলামের জয় হবে ইনশাআল্লাহ,2,2,2,1,2,2,2,2
আগামী বাংলাদেশ কোরআনের বাংলাদেশ,2,2,2,1,2,2,2,2
বাংলা দেশ জামায়াতে ইসলামী জিন্দাবাদ দাড়ি পাল্লা জিন্দাবাদ।,2,2,2,1,2,2,2,2
"মওদুদী মোনাফেকরা, দেশে একটা অস্থিতিশীল পরিবেশ সৃষ্টি করে, দেশের মানুষকে একটা সংকটময় পরিবেশে নিয়ে যেতে চায়",2,2,2,3,2,2,2,2
এই কানে ভাষন দেওয়া আপনাদের কে মানায় না পুজা মন্ড বে গিয়ে ভাষন দিলে ভালো লাগবে,2,2,2,3,2,2,2,2
সুষ্ঠ নির্বাচনের মাধ্যমে এবং জ'নগণের ভালোবাসায় আগামীর স'রকার গ'ঠন করবে জামায়াতে ইসলামী ।,2,2,2,1,2,2,2,2
একাত্তরের দালালরা এখন জামাতে ইসলাম,2,2,2,3,2,2,2,2
বাংলাদেশ জামায়াতে ইসলামী ও শিবিরের অনেক রক্ত যরেচে এই দেশে আর না আগামীতে জামায়াতে ইসলামীকে সরকারের আসনে দেখতে চাই,2,2,2,1,2,2,2,2
আগামী দিন হবে জামাত ইসলামের ইনশাল্লাহ,2,2,2,1,2,2,2,2
ইনশাআল্লাহ দাঁড়িপাল্লা,2,2,2,1,2,2,2,2
জামায়াতে ইসলামীর কথা ও কাজে মিল নেই,2,2,2,3,2,2,2,2
আগামীর বাংলাদেশ রোজা আর পূজা বিষ্ণু কৃষ্ণ মোহাম্মদ ঈসা মুসা মিলেমিশে একাকার এদের নাম বট বাহিনীর ইসলাম,2,2,2,3,2,2,2,2
পিয়ারের নামে ধর্ষণ বেশি করা হচ্ছে জামাত ইসলাম,2,2,2,3,2,2,2,2
পিআর দিয়ে জামায়াত ভোটের মাঠে আলোচনায় থাকতে চাই।,2,2,2,3,2,2,2,2
এই দলের হেবি ওয়েট প্রার্থীরা নির্বাচনে গো হারা হারার ভয়ে পি আর কে ঢাল হিসাবে ব্যবহার করতে মরিয়া,2,2,2,3,2,2,2,2
ইনসাফের মার্কা দাড়িপাল্লার মার্কা,2,2,2,1,2,2,2,2
"নারায়ে তাকবীর আল্লাহু আকবার, বাংলাদেশ জামাতে ইসলামী জিন্দাবাদ, দাঁড়িপাল্লা জিন্দাবাদ ,পিয়ার পিয়ার পিয়ার চাই পিয়ার ছাড়া উপায় নাই।",2,2,2,1,2,2,2,2
আপনারার আইন হল পোজা করা আপনারা হলেন মোনাপেক,2,2,2,3,2,2,2,2
"জামায়াত চরমোনাইয়ের আবিষ্কৃত নতুন জিকির, পিআর পিআর পিআর পিআর",2,2,2,3,2,2,2,2
দাড়ি পাল্লা মানেই হিন্দু,2,2,2,3,2,2,2,2
বাচাল আর মুনাফেকদের মিলনমেলা,2,2,2,3,2,2,2,2
জামায়াত একটা সুযোগ সন্ধানী শিয়াল,2,2,2,3,2,2,2,2
ন্যায় ইনসাফের প্রতীক দাড়িপাল্লার বিজয় হবে ইনশাআল্লাহ,2,2,2,1,2,2,2,2
বাটপার জামাত,2,2,2,4,2,2,2,2
আল্লাহর আইন যেখানে সীল মারবো সেখানে,2,2,2,1,2,2,2,2
আল কোরআনের আলো সংসদে জ্বালো,2,2,2,1,2,2,2,2
রাজাকারের বাচ্চা,2,2,2,4,2,2,2,2
আল্লাহর নাম বলে বলে আল্লাহর সাথে ধোঁকাবাজি আর কত,2,2,2,3,2,2,2,2
ভন্ড প্রতারক জামাত,2,2,2,4,2,2,2,2
জামাত মানে বাটপার,2,2,2,4,2,2,2,2
ওরে সিটার ওরে বাটপারের দল মুনাফিকের দল ওরে জান্নাতের দল,2,2,2,4,2,2,2,2
আওয়ামী লীগ জামাতকে নির্যাতন করতে করতে জনপ্রিয়তা বাড়িয়েছেন আর বিএনপি এনসিপি সমালোচনা করতে করতে সরকার গঠন করা পর্যন্ত নিয়ে যাবেন ইনশাআল্লাহ,3,3,3,1,2,2,2,2
"কোন কিছুই পরিস্কার বোঝা যায় না, কি ধোয়াসা, কি ইসলামী আইন, আল্লাহই জানে কি চান আপনারা।",2,2,2,3,2,2,2,2
ইনশাআল্লাহ আগামী নির্বাচনে জামায়াতে ইসলামী বিজয় আনবে,2,2,2,1,2,2,2,2
৭১ এর গনহত্যা কারী দের রাজনীতি নিষিদ্ধ চাই।,2,2,2,3,2,2,2,2
দাঁড়িওয়ালা বাটপার কাফের ফেরাউন মিথ্যাবাদী শয়তান,2,2,2,4,2,2,2,2
দাঁড়িপাল্লা ভোট দিব,2,2,2,1,2,2,2,2
"কোরআনের দোহাই দিয়ে, মানুষের ঈমান নিয়ে ছিনিমিনি খেলছে!",2,2,2,3,2,2,2,2
"হিন্দু মানেই জামায়াত, জামায়াত মানেই হিন্দু",2,2,2,3,2,2,2,2
ঈবলীশ শয়তানের দোসর মুর্তি পুজারী কাফের মুশরিকের দল জামাত শিবির !,2,2,2,4,2,2,2,2
চাকরি খেকো দল জামায়াত।,2,2,2,3,2,2,2,2
আমার জীবনের প্রথম ভোট দাঁড়ি পাল্লায় হবে।,2,2,2,1,2,2,2,2
আপনার ভোট আমানত হিসেবে দাঁড়ি পাল্লায় হোক।,2,2,2,1,2,2,2,2
"এবার জনগণ চাঁ'দাবাজ স'ন্ত্রাসী ঠেকাতে জামায়েতকে ভোট দেবে, ইনশাআল্লাহ",2,2,2,1,2,2,2,2
মুনাফেকেরা কিভাবে মানুষের কললকল্যান করবে ?,2,2,2,3,2,2,2,2
"চতুর দিকে জয়ের গান, আল্লাহ মেহেরবান, দাঁড়িপাল্লার হবে জয় শুকরিয়া করে যান",2,2,2,1,2,2,2,2
সব দল দেখা শেষ এবার জামায়াতে ইসলামীর বাংলাদেশ ইনশাআল্লাহ,2,2,2,1,2,2,2,2
তারুণ্যের প্রথম ভোট দাঁড়িপাল্লার পক্ষে হোক,2,2,2,1,2,2,2,2
জামাত ইসলাম কে বাংলাদেশ সরকার হিসেবে দেখতে চাই,2,2,2,1,2,2,2,2
"দাঁড়িপাল্লা দাঁড়িপাল্লা রহম কর হে আল্লাহ, দুর্নীতি আর চাঁদাবাজি চাইনা আমরা এ দেশে, আল্লাহ তুমি রহম করো মানুষকে ভালোবেসে ।",2,2,2,1,2,2,2,2
দুই সাপের এক কল্লা নৌকা আর দাঁড়িপাল্লা,4,2,2,4,2,2,2,2
আল কোরআন নামে আছে কাজে নাই তোমাদের।,2,2,2,3,2,2,2,2
জামায়াত জাতির কান্ডারী,2,2,2,1,2,2,2,2
আল কুরআনের আইন চাই সৎ লোকের শাসন চাই,2,2,2,1,2,2,2,2
এই জাতিকে আলোর দিশা দেখাতে পারে একমাত্র বাংলাদেশ জামাতে ইসলামী,2,2,2,1,2,2,2,2
"দাড়িপাল্লা জামায়াত ইসলামী একমাত্র বাংলাদেশ কে সুন্দর ভাবে পরিচালনা করতে পারে, আর বাকি যত গূলো দল আছে সবাই দুরনিতি বাজ",2,2,2,1,2,2,2,2
দাড়ি পাল্লার বিজয়।,2,2,2,1,2,2,2,2
মোনাফেকের দলের সাথে কিসের মিটিং,2,2,2,4,2,2,2,2
জনগণের মার্কা দাঁড়িপাল্লা মার্কা,2,2,2,1,2,2,2,2
আগামীর বাংলাদেশ হবে ইসলামের বাংলাদেশ ইনশাআল্লাহ,2,2,2,1,2,2,2,2
"জামাত ইসলাম প্রকৃত ইসলাম নয়, এদের টা ব্যবসায়িক ইসলাম।",2,2,2,3,2,2,2,2
বাংলাদেশ জামাতে ইসলামী মিথ্যা কথা বলে না ওরা,2,2,2,1,2,2,2,2
ইনশাআল্লাহ শিবির,2,2,2,1,2,2,2,2
"তাদের মানবতা ভোটের জন্য, তাদের সেজদা নামাজের পোস্ট ফেসবুকে দেয় ভোটের জন্য",2,2,2,3,2,2,2,2
"পূজা মন্ডপে যাওয়া ভোটের জন্য, কুরআন ফেসবুকে বিক্রি করা ভোটের জন্য",2,2,2,3,2,2,2,2
"তাদের দলের লোক রোজা পূজা কে সমান করে কথা বলে,,, ভোটের জন্য",2,2,2,3,2,2,2,2
তাদের দলের অনেক লোক ইসলাম অবমাননা হয় এমন কথা বলে ভোটের জন্য,2,2,2,3,2,2,2,2
"তাদের দলের কিছু মোল্লারা ইসলাম অবমাননার,, কথা শুনলেও প্রতিবাদ করেনা ভোটের জন্য",2,2,2,3,2,2,2,2
"এরা মানুষকে ইসলামের নাম দিয়ে ধোঁকা দিয়ে ক্ষমতায় আশা, এটাই তাদের মনের ইচ্ছা।",2,2,2,3,2,2,2,2
ইনশাআল্লাহ আগামীর বাংলাদেশ জামায়াতে ইসলামীর বাংলাদেশ।,2,2,2,1,2,2,2,2
ভন্ডের দল জামাত।,2,2,2,3,2,2,2,2
ভন্ড ইসলাম,2,2,2,3,2,2,2,2
সবচেয়ে বড় ভন্ডহইছে এই ইসলামিক দিক গুলো,2,2,2,3,2,2,2,2
ইনশাআল্লাহ এবার জিতবে দাঁড়ি পাল্লা,2,2,2,1,2,2,2,2
বাংলাদেশ ভণ্ড ইসলাম,2,2,2,3,2,2,2,2
আর কত ভন্ডামি ইসলামের লেভাস ধারী ভন্ড জামায়াত শিবির,2,2,2,3,2,2,2,2
স্বাধীনতার ৫৪ বছর মানে...জামাত ইসলাম কি স্বাধীনতা বিশ্বাস করে..?,2,2,2,3,2,2,2,2
দেশের সাধারণ মানুষের মনে ভালোবাসার এক নাম এখন বাংলাদেশ জামায়াতে ইসলাম,2,2,2,1,2,2,2,2
"আগামীর বাংলাদেশ, সাম্য মানবিকতার বাংলাদেশ।",2,2,2,1,2,2,2,2
"আগামীর বাংলাদেশ, জামায়াত শিবিরের বাংলাদেশ।",2,2,2,1,2,2,2,2
জুলুমকারী দল জামাতে ইসলামী,2,2,2,3,2,2,2,2
দাঁড়ি পাল্লা মার্কা হিন্দুদের মার্কা।,2,2,2,3,2,2,2,2
"করতেন তো জাসদ,,,,, আইছেন চো*দাতে জামায়াত",2,2,2,4,2,2,2,2
ক্ষমতায় আসলে তো দেশটা জঙ্গিতে ভড়ায় দিবেন।,2,2,2,3,2,2,2,2
"৭১ থেকে জুলাই সনদ অবদি, জামাতের পল্টি থামছে না।",2,2,2,3,2,2,2,2
জামাত আর তামাক উভয়ই ক্ষতিকর জামাত ধর্মের জন্য আর তামাক শরীরের জন্য,2,2,2,3,2,2,2,2
এবার নির্বাচনে জামায়াতে ইসলামী জিতবে ইনশাআল্লাহ।,2,2,2,1,2,2,2,2
ইনশাআল্লাহ জামাত ইসলামীর বাংলাদেশ,2,2,2,1,2,2,2,2
ইনশাআল্লাহ আসবে জামাতে ইসলাম,2,2,2,1,2,2,2,2
আলহামদুলিল্লাহ জামায়াত ইসলাম কে আল্লাহ এর জন্য ভালোবাসি,2,2,2,1,2,2,2,2
জামাত তো দেশের সাথে বেঈমানী করছে,2,2,2,3,2,2,2,2
বাংলাদেশ জামাত ইসলাম সত্যবাদী দল,2,2,2,1,2,2,2,2
বাংলাদেশ জামায়াতে ইসলামী ছাত্রশিবির জিন্দাবাদ সবার জন্য দোয়া ও ভালোবাসা রইলো,2,2,2,1,2,2,2,2
"যে সব ইসলামিক দল এবং সেলিব্রেটি বক্তারা ইসকন ইস্যু নিয়ে নীরব, আমরা ধরে নেব—আপনারা ভারতের কাছে বিক্রি হয়ে গেছেন।",2,2,2,3,2,2,2,2
"আল্লহ তায়ালার আইন চাই, সত লোকের শাসন চাই",2,2,2,1,2,2,2,2
পাকিস্তানের দালালেরা হুশিয়ার সাবধান,2,2,2,3,2,2,2,2
"জামাত ৭১ এর অপরাধী, হাসিনা ২৪ এর অপরাধী।",3,2,2,3,2,2,2,2
জামাত ইসলাম মানেই একটা ব্র্যান্ড,2,2,2,1,2,2,2,2
জামায়াত শুধু জুম্মার দিনে আন্দোলন করে গেটের সামনে যাতে করে মসজিদ থেকে লোক বাহির হলে বোঝা যায় আন্দোলনে অনেক মানুষ আছে।,2,2,2,3,2,2,2,2
"শুধু আন্দোলন আর আন্দোলন,, জমায়েত মানে আন্দোলন বিএনপি মানে নিবাচন",2,3,2,3,2,2,2,2
ভণ্ড জামায়াত দেশে অরাজকতা সৃষ্টি করতে চাচ্ছে।,2,2,2,3,2,2,2,2
"রাজাকারেরা হাসতে হাসতে ক্ষমা চাচ্ছে,নির্বাচনকে সামনে রেখে ক্ষমা চাওয়ার নাটক.....কি লজ্জা",2,2,2,3,2,2,2,2
হেঁদুরা কোনো কালেই জামায়াতকে ভোট দেবে না।,2,2,2,3,2,2,2,2
ইসকন ও ইসরায়েল ইস্যু তে ভণ্ড জামায়াত চুপ কেনো?,2,2,2,3,2,2,2,2
জামাত কি ঈমামদের ব্যপারে উদাসীন?,2,2,2,3,2,2,2,2
এই দেশ ও জাতির মুক্তি একমাত্র ইসলাম প্রতিষ্ঠার মাধ্যমেই সম্ভব।,2,2,2,1,2,2,2,2
বাংলাদেশ জামাতে ইসলাম এটা একটা গাদ্দার সংগঠনের নাম।,2,2,2,3,2,2,2,2
এই দেশের ১৩ টা বাজাতে যা যা করা দরকার জামায়াত ইসলামী তাই করবে সাধারণ মানুষের ভোগান্তির শেষ কোথায়?,2,2,2,3,2,2,2,2
নিজেদের ক্ষমতার জন্য সব কিছুর দাবি করতে পারলেও ইসলাম ও মুসলিমের জন্য তাদের কিছু করার নেই।,2,2,2,3,2,2,2,2
আপনারা শুধু ইসলাম টাকে ব্যবহার করছেন ক্ষমতায় যাওয়ার জন্য,2,2,2,3,2,2,2,2
ইস্কন নিয়ে জামায়াতের কোনো বিবৃতি চোখে পড়লো না।,2,2,2,3,2,2,2,2
জামাতি ভন্ডরা নির্বাচন আসলে তার থার্ড ক্লাস কর্মীরা অন্যদের নিয়ে নোংরা নোংরা পোস্ট করে মহান আল্লাহর সান্নিধ্য লাভ করতে চায়।,2,2,2,3,2,2,2,2
বাস্তবে এরা পদ পেলেই মসজিদ দখল করে নোংরা রাজনীতি করে।,2,2,2,3,2,2,2,2
ছোট বেলা থেকে জামাতি ভন্ডদের বাটপারি দেখেই বড় হইছি।,2,2,2,3,2,2,2,2
ইসকনের ব্যাপারে কোন আওয়াজ নেই জামাআতের।,2,2,2,3,2,2,2,2
নিজের খাই নিজের পরি ভালো লাগে তাই দ্বীন কায়েমের জন্য শিবির করি,2,2,2,1,2,2,2,2
একটা সুন্দর দেশকে অস্থিতিশীল করতে জামাতের ভুমিকা অপরিসীম।,2,2,2,3,2,2,2,2
দখলবাজি চাঁদাবাজিতে শীর্ষে জামাত ইসলামি,2,2,2,3,2,2,2,2
"ডা. শফিকুর রহমান মহোদয়ের এই অঙ্গীকার শুধু একটি বাক্য নয়, এটি এক ঈমানি শপথ — অন্যায়ের অন্ধকারে ন্যায়ের আলো জ্বালানোর প্রতিশ্রুতি।",2,2,2,1,2,2,2,2
আগামী দিনে জামায়াতে ইসলামীর বিজয় লাভ দেখবো ইনশাআল্লাহ,2,2,2,1,2,2,2,2
ইনশাআল্লাহ বাংলাদেশ জামায়াত ইসলামী জিন্দাবাদ জিন্দাবাদ জিন্দাবাদ,2,2,2,1,2,2,2,2
দাড়িপাল্লার দিন শেষ ডিজিটাল স্কেল এর বাংলাদেশ।,2,2,2,3,2,2,2,2
আমরা ইসলাম বেচা নিয়ে লিপ্ত,2,2,2,3,2,2,2,2
তোমাদের তো জম্মটাই অপকর্মের মাধ্যমে,2,2,2,3,2,2,2,2
আপনারা মন্দিরে গিয়ে ঠিকই গীতা পাঠ করতে পারেন কিন্তু দুই পারসেন্ট ভোট কমে যাবে বলে মুসলিম বোনের ধর্ষণের ব্যাপারে কথা বলছেন না।,2,2,2,3,2,2,2,2
এবার ভোটটা দিব আমরা দাঁড়িপাল্লাতে ভাই,2,2,2,1,2,2,2,2
"বাংলাদেশ জিন্দাবাদ, দাঁড়িপাল্লা মার্কা জিন্দাবাদ।",2,2,2,1,2,2,2,2
জামাত জিতবে,2,2,2,1,2,2,2,2
"নামধারী মুসলিম, হিন্দু, বোদ্ধা, ইহুদি, খ্রিষ্টান,ইসকন, এই সবগুলো মিক্সিং হলো জামাত।",2,2,2,3,2,2,2,2
"নীল নদের পানি নীল নয়, তেমনি জামাত ইসলাম ইসলামি দল নয়।",2,2,2,3,2,2,2,2
"শুধু নির্বাচন নয় বাংলাদেশের সকল সেক্টর, গুরুত্বপূর্ণ দপ্তর ও গুরুত্বপূর্ণ পদ থেকে এই মুনাফেকদের বিতাড়িত করতে হবে, এরা দেশের শত্রু এবং এরা ইসলামের শত্রু।।।",2,2,2,3,2,2,2,2
জনগণ জামায়াতকে ক্ষমতায় দেখতে চায়,2,2,2,1,2,2,2,2
"ইসলামের নাম ভাঙিয়ে রাজনীতি, কিন্তু ইসলাম যখন আঘাতপ্রাপ্ত — তখন “নীরবতার রাজনীতি”!",2,2,2,3,2,2,2,2
জামায়াতে ইসলামীর মাধমেই এদেশে ইসলামী রাষ্ট্র ব্যবস্থা প্রতিষ্ঠিত হবে ইনশাআল্লাহ।,2,2,2,1,2,2,2,2
জামাতে ইসলাম ইসলামের শত্রু তোদের ইস্কন নিয়ে কোন আলোচনা নাই তোরা ইসলামের দুশমন ইসকনের বন্ধু বাংলাদেশের মধ্যে জামাতে ইসলাম ইসকনকে সহযোগিতা করে,2,2,2,3,2,2,2,2
