Text,BAL,BNP,NCP,BangladeshJamaat_e_Islami,AB_Party,UPB,JaPa,GOP
মাশাল্লাহ আলহামদুলিল্লাহ দাড়িপাল্লা জিন্দাবাদ,2,2,2,1,2,2,2,2
"সুশীল মারানী রা, তোদের,লেবাস খুলে,নাম থেকে ইসলাম শব্দ টা বাদ দে ।",2,2,2,4,2,2,2,2
ক্ষমতা এতো স্বাদ?! তাই বলে কি ক্ষমতার জন্য ঈমান-ইসলাম বিক্রি করে দিবেন?,2,2,2,3,2,2,2,2
৭১ এর ধর্ষকদের পাহারাদাররা ৭১ এর ভয় জুলাই গাঞ্জা খেয়ে পরে আছে,2,2,2,4,2,2,2,2
দাড়ি পাল্লা,2,2,2,1,2,2,2,2
তোমাদের দাবিগুলোর মধ্যে ইসকন নিষিদ্ধের দাবি টা তাকার জরুরি ছিলো না? তোমরা আবার নিজেকে ইসলামিক দল দাবি করো,2,2,2,3,2,2,2,2
"নৌকা লাঙ্গল ধানের শীষ সব দেখা শেষ, এবার জামায়াতে ইসলামীর বাংলাদেশ।",3,3,2,1,2,2,2,2
অবাধ সুষ্ঠু নিরপেক্ষ নির্বাচন হলে বাংলাদেশ জামায়াতে ইসলামী বিপুল ভোটে বিজয় অর্জন করবে ইনশা আল্লাহ।,2,2,2,1,2,2,2,2
নতুন প্রজন্মের প্রথম ভোট দাড়ি পাল্লা মার্কায় হোক।,2,2,2,1,2,2,2,2
১৯৭১ এর গনহত্যাকারী দল জামায়াত এর কোনো দাবি সরকার মেনে নেবেনা।,2,2,2,3,2,2,2,2
বাংলাদেশ জামায়াতে ইসলামী হিন্দু শাখা ও ইসকন শাখার পক্ষ থেকে এদের শুভেচ্ছা জানানো হোক।,2,2,2,3,2,2,2,2
জামাত করিনা তবে পছন্দ করি,2,2,2,1,2,2,2,2
"সংযুক্ত আরব আমিরাতের শারজাহ থেকে, জামায়াত ইসলামী জিন্দাবাদ",2,2,2,1,2,2,2,2
দলীয় স্বার্থে ইসলামকে ব্যবহার করেন।,2,2,2,3,2,2,2,2
সব দেখেছি বারবার দাড়ি পাল্লা এইবার,2,2,2,1,2,2,2,2
বাংলাদেশের মাটিতে ইসলাম বিকৃত করে রাজনীতি চলবে না,2,2,2,3,2,2,2,2
"আমি একজন মুসলিম হিসেবে বলতে চাই — আমরা যেন এমন দল ও নেতৃত্বকে সমর্থন করি, যারা কোরআন ও সুন্নাহকে ভিত্তি করে দেশ পরিচালনা করতে চায়, জনগণের ন্যায্য অধিকার আদায়ের জন্য কাজ করে, এবং সমাজে ন্যায়, সততা ও শান্তি প্রতিষ্ঠা করে।",2,2,2,1,2,2,2,2
"আসুন, আমরা সবাই ইসলামী রাজনীতিকে ভালোবাসি, ইসলামি আদর্শের পক্ষে দাঁড়াই এবং আল্লাহর সন্তুষ্টির জন্য ন্যায়ের রাজনীতি প্রতিষ্ঠা করি।",2,2,2,1,2,2,2,2
"মুসলমান হিসেবে আমাদের দায়িত্ব হলো সেই দল ও নেতৃত্বকে সমর্থন করা, যারা কোরআন ও সুন্নাহর আলোকে সমাজ ও রাষ্ট্র পরিচালনা করতে চায়।",2,2,2,1,2,2,2,2
"বর্তমান সময়ে দেখা যাচ্ছে, ইসলামী দলগুলোর নেতৃবৃন্দ আলেম-ওলামা, শিক্ষিত ও নীতিবান মানুষ, জনগণের হক নষ্ট করে না, বরং ন্যায় ও ইনসাফ প্রতিষ্ঠার জন্য কাজ করে যাচ্ছে।",2,2,2,1,2,2,2,2
ইসলাম এবং কোরআন কে রাজনৈতিক হাতিয়ার বানালেন আর মসজিদ কোরআন কে চোট করে নিজেদের রাজনৈতিক ফায়দা নিলেন।,2,2,2,3,2,2,2,2
ধর্মের নাম দিয়ে মানুষের আবেগে নিয়ে খেলা খুবই ভয়ংকর।,2,2,2,3,2,2,2,2
নাম ইসলামী দিয়ে অন্তরে দলীয় রাজনৈতিক বীজ বোপন একধরনের প্রতারণা।,2,2,2,3,2,2,2,2
দলীয় চিন্তাভাবনা নিয়ে ইসলামের দোহাই দিয়ে মানুষের আবেগকে কাজে লাগিয়ে রাজনীতি সমাজে আরো বিশৃঙ্খলা সৃষ্টি করবে।,,2,2,3,2,2,2,2
সমাজ বিভক্তির সবচেয়ে বড়ো দায় জামাত কে নিতে হবে।,2,2,2,3,2,2,2,2
নাস্তিকদের আলেমদের গালাগালি করার সুযোগ করে দিয়েছে জামাত অথচ সব আলেম তাদের পক্ষে ছিলো না।,2,2,2,3,2,2,2,2
মসজিদকে দলীয় অফিস না বানিয়ে নিজেদের দলীয় অফিস বানান পাড়ায় পাড়ায়।,2,2,2,3,2,2,2,2
বুদ্ধি বৃত্তিক ভাবে মসজিদ এবং ইসলাম কে দলীয় স্বার্থে ব্যবহার করে মসজিদ কে ডিল ছোঁড়ার জায়গা বানানোর জন্যে জামাত দায়ী।,2,2,2,3,2,2,2,2
মসজিদ কোন দলের না সকল মুসলমানের।,2,2,2,3,2,2,2,2
দাঁড়িপাল্লার বিজয় হবে ইনশাআল্লাহ,2,2,2,1,2,2,2,2
ভারতীয় এজেন্ডা বাস্তবায়নে মাঠে নেমেছে জামাত শিবির ও চরমোনাই ভন্ড তাদের মূল উদ্দেশ্য ষড়যন্ত্র করে দেশ কে অস্থিতিশীল করা,2,2,2,3,2,2,2,2
ইনশাআল্লাহ দেশে নিরাপদ ইসলামী দলের কাচেই আশা করা জায়,2,2,2,1,2,2,2,2
মোনাফেকর বাচ্চা,2,2,2,4,2,2,2,2
"জামাতের মুখ থেকে ""বাংলাদেশকে ভালবাসি"" শুনা আর মিয়া খলিফার মুখ থেকে আমি ""ভার্জিন"" শুনা একই কথা",2,2,2,4,2,2,2,2
জামাত জাতীয় বেইমান,,2,2,3,2,2,2,2
"গ্রামের জামায়াত নেতৃত্ব নিজেদের চরিত্র উন্নত মানের স্তরে নিয়ে যাবে, এটাই প্রত্যাশা।",2,2,2,1,2,2,2,2
"এনসিপির প্রত্যেকটা সদস্য ব্রিলিয়ান্ট, টেকনিক্যালি জিনিয়াস,বিচক্ষন, দুর্দান্ত।",2,2,1,2,2,2,2,2
শাপলা কলির জয় হোক।,2,2,1,2,2,2,2,2
গ্রাম শহর অলিগলি ১২ তারিখে জিতবে এবার শাপলা কলি,2,2,1,2,2,2,2,2
"জিতবে এবার শাপলা কলি,ইনকিলাব জিন্দাবাদ",2,2,1,2,2,2,2,2
শাপলা কলি ২০২৬!,2,2,1,2,2,2,2,2
সারা বাংলার অলি গলী রব উঠেছে শাপলা কলি।,2,2,1,2,2,2,2,2
ঢাকা ১৯/২০ আসনের এনসিপি'র হাইব্রিড প্রার্থী'দের বয়কট করবে স্থানীয় সাধারণ জনগন।,2,2,3,2,2,2,,2
অভিনন্দন। শূভ কামনা রইল। তরূণদের প্রথম ভোট এন সি পির শাপলা কলি প্রতীকে হোক। ইনকিলাব জিন্দাবাদ।,2,2,1,2,2,2,2,2
অভিনন্দন জানাই আমরা মানিকগঞ্জ জেলার জাতীয় নাগরিক পার্টি এনসিপির সকল নেতাকর্মী সমর্থকদের পক্ষে,2,2,1,2,2,2,2,2
গ্রাম শহর অলিগলি মাইর খাবে শাপলা কলি,2,2,3,2,2,2,2,2
বেশির ভাগ পোলাপানই হাটুর বয়সী,2,2,3,2,2,2,2,2
ভাই আপনারা দেশের বড় একটা সংখ্যার কাছে গ্রহণযোগ্যতা হারিয়েছেন,2,2,3,2,2,2,2,2
"১২ ফেব্রুয়ারি সারাদিন গণভোটে হ্যাঁ দিন, শাপলা কলিতে ভোট দিন",2,2,1,2,2,2,2,2
এনসিপির এতো বেশি আসনে লড়াই করার চেয়ে ৫০ টা আসনে কোয়ালিটি ফুল লড়াই দেওয়া উচিত।,2,2,1,2,2,2,2,2
"এনসিপির প্রতি মানুষের আগ্রহ আছে, মানুষের সাথে মিশতে পারৱে কেউ ফিরায়া দিবে না।",2,2,1,2,2,2,2,2
এনসিপির নেতাদের প্রতি আহবান মাঠে নামুন ভাই। জনতার সাথে মিশুন অনেক দেরি করে ফেলছেন যদিও তাও লড়াইটা করুন,2,2,1,2,2,2,2,2
বাংলাদেশ টোকাই পার্টি,2,2,3,2,2,2,2,2
জুলাই চুদি কুড়িগ্রাম জেলা রাজারহাট উপজেলা দিনোবাজার পারলে মব বাহিনী নিয়ে আসিয়েন,2,2,4,2,2,2,2,2
শাপলা সততার সাথে টিকে থাকুক সবার প্রিয় ও ভালোবাসা নিয়ে।,2,2,1,2,2,2,2,2
এনসিপি জিতলে জিতবে বাংলাদেশ,2,2,1,2,2,2,2,2
"জুলাই চেতনা বিক্রির দিন শেষ, তফসিলের বাংলাদেশ ।",2,2,3,2,2,2,2,2
গণভোটে হ্যাঁ বলি মার্কা এবার শাপলা কলি।,2,2,1,2,2,2,2,2
দেশ ধ্বংসের কারিগর জুলাই ব্যবসায়ী হঠাও বাংলাদেশ বাঁচাও,2,2,3,2,2,2,2,2
নাসিরউদ্দিন পাটোয়ারী অনেক সুন্দর করে জনগণের মনের কথা গুলো প্রকাশ করেছেন ধন্যবাদ ভাইকে,2,2,1,2,2,2,2,2
এনসিপি কে সাপোর্ট করে এগিয়ে নেওয়া প্রত্যেক সচেতন নাগরিকের দায়িত্ব।,2,2,1,2,2,2,2,2
"তারুণ্যের নেতৃত্বই এগিয়ে যাবে বাংলাদেশ ইনশাআল্লাহ, ইনকিলাব  জিন্দাবাদ",2,2,1,2,2,2,2,2
শাপলা কলির জয় হোক সেটা বিরোধী দল হিসেবে হলেও,2,2,1,2,2,2,2,2
শালায় যেন ভাগতে না পারে আমার চ্যাটে বাল এনসিপি,2,2,4,2,2,2,2,2
বাংলাদেশের জনগণ জাতীয় নাগরিক পার্টির সাথে যুক্ত হয়ে বাংলাদেশকে এগিয়ে নিতে হবে।,2,2,1,2,2,2,2,2
এনসিপির কার্যকলাপ যতদিন জনগণের পক্ষে থাকবে ততদিন আমরাও আপনাদের পাসে আছি থাকবো ইনশাআল্লাহ,2,2,1,2,2,2,2,2
"কতবড় নহারামজাদার দল এরা একবার দেখেন, সারাদেশে শহীদ মিনার ভেঙে,মুক্তিযোদ্ধাদের আপমান করে এরাই আবার শহীদ মিনারে পাদতলে। ভণ্ডামির শেষ কোথায়?",2,2,4,2,2,2,2,2
এগিয়ে এসো নতুনদের পথে,2,2,1,2,2,2,2,2
"আচ্ছা ভাই আবেগে কি সব কিছু সম্ভব, আপনাদের আবেগ বেশি",2,2,1,2,2,2,2,2
উনার প্রতি সম্মান রেখেই বলছি এনসিপি মানুষের আবেগ অনুভূতিকে টার্ম কার্ড হিসেবে ব্যবহার করলো।,2,2,3,2,2,2,2,2
"এনসিপি জনগণের আস্তা, গণমানুষের ভালোবাসা'র প্রতীক শাপলা কলি",2,2,1,2,2,2,2,2
"এনসিপি সব সময় জুলাই জোদ্ধাদের পাশে ছিল,আছে, থাকবে।",2,2,1,2,2,2,2,2
এনসিপি এর সকল কর্মকান্ড আলহামদুলিল্লাহ অনেক ভালো।,2,2,1,2,2,2,2,2
এই বাচ্চা ছেলেদের এই হাঁটুর বয়সী ছেলেদের কারণেই বুড়া ধামরারা আজকে বাচ্চা হাঁটুর বয়স বলে গালি দিতে পারে,2,2,3,2,2,2,2,2
ফালতু এনসিপি বয়কট। কিসের সাথে কি পান্তা ভাতে ঘি,2,2,3,2,2,2,2,2
এনসিসির ফুটেজ খোরি মানুষ আর খায় না,2,2,3,2,2,2,2,2
আবেগ দিয়ে দেশ চালাবেন? যোগ্য লোক নিয়ে আসেন।,2,2,1,2,2,2,2,2
আবেগের দোচনে বাচে না,2,2,4,2,2,2,2,2
"মিথ্যা আশ্বাস, এরা মানুষের সাথে এভাবেই ছয় নয় করছে",2,2,3,2,2,2,2,2
দেশটা আবেগে ভরে গেছে,2,2,3,2,2,2,2,2
জুলাই টোকাই,2,2,3,2,2,2,2,2
উন্নয়নের দিন শেষ রিকশাওলা আর পতিবন্ধির বাংগা দেশ,2,2,3,2,2,2,2,2
কলি কখনো ফুটবে না ভুঝলে সোনা গো আমার-মানুষ এই কয়েক মাসে বুঝে গেছে কলির ভিতর পোকা আছে।।,2,2,3,2,2,2,2,2
এনসিপি নব্য রাজাকার টিকতে না বেশিদিন,2,2,3,2,2,2,2,2
জুলাই জঙ্গি রাজাকার চুদি,2,2,4,2,2,2,2,2
ফুটবে কলি হাসবে দেশ এন সি পি গড়বে নতুন বানলাদেশ।।,2,2,1,2,2,2,2,2
দলমত নির্বিশেষে দেশের চিকিৎসা ব্যবস্থাকে উন্নতর অবস্থানে নিয়ে যেতে চাইলে জারা আপুকে ভোট দিতেই হবে। তার কোন বিকল্প নাই।,2,2,1,2,2,2,2,2
"মানুষ পরিবর্তন চায়, সেটা এনসিপি তে সম্ভব",2,2,1,2,2,2,2,2
দরকার হলে আমরা প্রবাসী বাঙালিরা নির্বাচন প্রচারণা চালানোর জন্য এনসিপি কে টাকা পাঠাবো।,2,2,1,2,2,2,2,2
আপনারা একসময় ছিলেন হিরো এখন আপনারা হয়ে গেছেন জিরো,2,2,3,2,2,2,2,2
দেশের জনগণ চলো আমরা নাহিদ ইসলামের সাথে যুক্ত হয়ে দেশকে সুন্দর ভাবে সাজিয়ে তুলি।,2,2,1,2,2,2,2,2
"এত অল্প সময়ে জনপ্রিয়তা পাওয়া দলটা ইনশাআল্লাহ খুব শীঘ্রই জনতার হয়ে সংসদে আওয়াজ তুলবে,জনতার হয়ে জনতার কথা বলবে। ",2,2,1,2,2,2,2,2
তারুন্যর প্রথম ভোট শাপলা কলির পক্ষে হোক।,2,2,1,2,2,2,2,2
"এনসিপি একটা সিট ও না পাক,কোন সমস্যা নেই। সুস্থ রাজনৈতিক চর্চা তো শুরু করতে পেরেছি আমরা এটা এই প্রজন্ম জন্য যথেষ্ট।💘",2,2,1,2,2,2,2,2
আগামীর ব্যালট হবে বুলেটের বিরুদ্ধে মাফিয়াতন্ত্রের বিরুদ্ধে পরিবারতন্ত্রের বিরুদ্ধে ,2,2,1,2,2,2,2,2
"জুলাইয়ের গণ-অভ্যুত্থানের মধ্য দিয়ে গড়ে ওঠা, জাতীয় নাগরিক পার্টি-এনসিপির জন্য শুভকামনা।",2,2,1,2,2,2,2,2
যাদের হাত ধরে বিএনপি নতুন করে ক্ষমতায় আশার স্বপ্ন দেখছে তাদের শুভকামনা দিতেই হবে।,2,2,1,2,2,2,2,2
যাদের হাত ধরে বহিষ্কার হওয়া জামায়েত রাজনীতি করার সুযোগ পেয়েছে তাদের শুভকামনা দিতেই হবে,2,2,1,2,2,2,2,2
যাদের নেতৃত্বে ত্যাগের বিনিময় তরুণ যুবসমাজ রাতের ভোট দিনে দেওয়ার সুযোগ পেয়েছে তাদের শুভকামনা দিতেই হবে তা না হলে আমরা বড় অকৃতজ্ঞ জাতি হিসেবেই পরিগনিত হব।,2,2,1,2,2,2,2,2
ছোট্ট ছোট্ট পায়ে চলতে চলতে ঠিক পৌঁছে যাবে।। ইনশাল্লাহ এগিয়ে যাক এনসিপি।।,2,2,1,2,2,2,2,2
চারিদিকে শুর উঠেছে শাপলা কলি যাবে জিতে।,2,2,1,2,2,2,2,2
এনসিপি দলটাকে শক্ত করে ভাল নেতা কর্মী দ্বারা পরিচালনা কর দেখবে বাংলাদেশে বড় দল হিসেবে প্রতিষ্ঠিত হবে।,2,2,1,2,2,2,2,2
জনতার রায়কে প্রাধান্য দিয়েই আমরা আগামীর সরকার গঠন করবো ইনশাআল্লাহ শাপলা কলি হবে শান্তি এবং ন্যায়এর প্রতিক ইনশাআল্লাহ,2,2,1,2,2,2,2,2
"লুটপাট, মাফিয়াতন্ত্র আর দুর্নীতির অন্ধকার থেকে বাংলাদেশকে মুক্ত করতে হলে তরুণদের নেতৃত্বই হতে হবে পরিবর্তনের আগুন।",2,2,1,2,2,2,2,2
এনসিপি আপনাদের সকল প্রার্থীর জন্য আমার দোয়া এবং ভালোবাসা রইলো | এনসিপি আমার ভালবাসার দল |,2,2,1,2,2,2,2,2
দিন দিন এনসিপির জনপ্রিয়তা হারিয়ে যাচ্ছে। তাই কঠিন সচেতন হওয়া দরকার।,2,2,1,2,2,2,2,2
সারভিস আলম নাহিদ এদেরকে আরো জনসম্মুখে বেশি দেশ কল্যান নিয়ে কথা বলা দরকার,2,2,1,2,2,2,2,2
শাউয়া পার্টি,2,2,4,2,2,2,2,2
"তোরা জুলাইয়ের গাদ্দার,ক্ষমতা তোদের কাছে বড় হয়ে গেছে,হাদি ভাইয়ের লাশ ভুলে কিভাবে পারলি প্রথম কালো আর ডাইনী সিস্টার দেখতি",2,2,3,2,2,2,2,2
"এনসিপি এর হাতেই, বাংলাদেশ নিরাপদ",2,2,1,2,2,2,2,2
"দুঃখের সাথে বলতে হচ্ছে এনসিপির সাথে জণগণ আর কোন আন্দোলনে নাই, বিশেষ করে তাওহীদি জনতা।",2,2,3,2,2,2,2,2
প্রথম আলো ডেইলি স্টারের সহযোগী এনপিপির নেতা গুলিবিদ্ধ।,2,2,3,2,2,2,2,2
হায়রে এনসিপি!নিজের কর্মীদের নিরাপত্তা দিতে সক্ষম না।,2,2,3,2,2,2,2,2
"এর জন্য দায়ী আপনারা, আপনারা মব মব করে এই পরিস্থিতি সৃষ্টি করেছেন, এখন এর খেসারত দিতে হচ্ছে প্রান্তিক পর্যায়ের নেতাদের।",2,2,3,2,2,2,2,2
এন সি পি হ্যালো মাগীবাজ ও মাদক ব্যবসায়ীদের দল।,2,2,4,2,2,2,2,2
"আপনারা কি কিছুই করবেন না,,শুধু দুঃখ প্রকাশ এবং অথর্ব সরকারের কাছে বিচার চাইবেন??",2,2,3,2,2,2,2,2
"এসবের জন্য এনসিপিই দায়ী, ক্ষমতার লোভে এরা এখন সুশীল সেজে বসে আছে।",2,2,3,2,2,2,2,2
এদেশের মানুষ আস্তে আস্তে এসব ক্ষমতা লোভী ছেলেদের থেকে মুখ ফিরিয়ে নিচ্ছে।,2,2,3,2,2,2,2,2
জুলাই বিপ্লব যদি ব্যর্থ হয় তবে এদেশের লক্ষ তরুণ এনসিপির এসব নেতারদের কখনোই ক্ষমা করবে না।,2,2,3,2,2,2,2,2
ওদের জন্যই বিপ্লবী সরকার গঠন করা সম্ভব হয়নি। ওদের কঠিন বিচার হবে একদিন।,2,2,3,2,2,2,2,2
যাও এনসিপি প্রথম আলো ডেইলি স্টার ঠিক আছে কিনা খোজ নাও আর আসিফ নজরুল স্বরাষ্ট্র উপদেষ্টা জাহাঙ্গীর রে কোলে নিয়ে ঘুমাও,2,2,3,2,2,2,2,2
খুবি ভালো হইছে তোরা প্রথম আলো আর দিল্লি স্টারের সাতে প্রেম কর!,2,2,3,2,2,2,2,2
নেশা করতে গিয়ে গুলিতে আহত এনসিপি নেতা মোতালেব।,2,2,3,2,2,2,2,2
"আমরা কোন মবের পক্ষে না, নাহিদ কে পাঠিয়ে প্রথম আলো তে আরো কিছু কান্নাকাটি করতে বলো, তোমাদের পিছনে এখন আর মানুষ নামবে না ।",2,2,3,2,2,2,2,2
"বিপ্লব তো আর গাছে ধরা আপেল নয় যে পাকবে আর পড়বে, বিপ্লব অর্জন করতে হয়।আপনারা বিপ্লবী হয়েও সুশীল সেজেছেন এটাই পরিনতি।",2,2,3,2,2,2,2,2
প্রিয় এনসিপির রাজপথের সহযোদ্ধা ভাই ও বোনেরা আপনারা এখনই যদি এই হত্যাকাণ্ডের ব্যাপারে সোচ্চার না হোন তাহলে আপনারা কেউ রেহাই পাবেন না।,2,2,3,2,2,2,2,2
